name,education,quote
Antoni Gaudí,https://imgix.ranker.com/node_img/24/476345/original/antoni-gaud-writers-photo-1?auto=format&q=60&fit=crop&fm=pjpg&dpr=2&w=375,"Antoni Gaudí i Cornet was a Spanish Catalan architect from Reus and the best known practitioner of Catalan Modernism. Gaudí's works reflect an individualized and distinctive style. Most are located in Barcelona, including his magnum opus, the Sagrada Família. Gaudí's work was influenced by his passions in life: architecture, nature, and religion. Gaudí considered every detail of his creations and integrated into his architecture such crafts as ceramics, stained glass, wrought ironwork forging and carpentry. He also introduced new techniques in the treatment of materials, such as trencadís which used waste ceramic pieces. Under the influence of neo-Gothic art and Oriental techniques, Gaudí became part of the Modernista movement which was reaching its peak in the late 19th and early 20th centuries. His work transcended mainstream Modernisme, culminating in an organic style inspired by natural forms. Gaudí rarely drew detailed plans of his works, instead preferring to create them as three-dimensional scale models and molding the details as he conceived them. Gaudí's work enjoys global popularity and continuing admiration and study by architects.",Age: Dec. at 73 (1852-1926),"Place of Birth: Tarragona, Reus, Spain","Structures: Sagrada Família, Church of Colònia Güell, Episcopal Palace, Astorga, Palau Güell"
Frank Gehry,https://imgix.ranker.com/node_img/51/1018960/original/frank-gehry-architects-photo-1?auto=format&q=60&fit=crop&fm=pjpg&dpr=2&w=375,"Frank Owen Gehry, CC is a Canadian architect born in Canada, currently a United States resident based in Los Angeles. A number of his buildings, including his private residence, have become world-renowned tourist attractions. His works are cited as being among the most important works of contemporary architecture in the 2010 World Architecture Survey, which led Vanity Fair to label him as ""the most important architect of our age"". Gehry's best-known works include the titanium-clad Guggenheim Museum in Bilbao, Spain; Walt Disney Concert Hall in downtown Los Angeles; Louis Vuitton Foundation in Paris, France; MIT Ray and Maria Stata Center in Cambridge, Massachusetts; The Vontz Center for Molecular Studies on the University of Cincinnati campus; Experience Music Project in Seattle; New World Center in Miami Beach; Weisman Art Museum in Minneapolis; Dancing House in Prague; the Vitra Design Museum and the museum MARTa Herford in Germany; the Art Gallery of Ontario in Toronto; the Cinémathèque française in Paris; and 8 Spruce Street in New York City.",Age: 94,"Place of Birth: Toronto, Canada","Structures: Dwight D. Eisenhower Memorial, Frank Gehry Residence, Peter B. Lewis Building, Santa Monica Place, BP Pedestrian Bridge"
Frank Lloyd Wright,https://imgix.ranker.com/node_img/51/1019457/original/frank-lloyd-wright-writers-photo-1?auto=format&q=60&fit=crop&fm=pjpg&dpr=2&w=375,"Frank Lloyd Wright was an American architect, interior designer, writer, and educator, who designed more than 1,000 structures, 532 of which were completed. Wright believed in designing structures that were in harmony with humanity and its environment, a philosophy he called organic architecture. This philosophy was best exemplified by Fallingwater, which has been called ""the best all-time work of American architecture"". Wright was a leader of the Prairie School movement of architecture and developed the concept of the Usonian home, his unique vision for urban planning in the United States.",Age: Dec. at 91 (1867-1959),"Place of Birth: Richland Center, Wisconsin","Structures: Beth Sholom Congregation, Coonley House, The Last Wright: Frank Lloyd Wright and the Park Inn Hotel, John D. Haynes House, D. D. Martin House Complex"
Richard Neutra,https://imgix.ranker.com/node_img/96/1905780/original/richard-neutra-writers-photo-1?auto=format&q=60&fit=crop&fm=pjpg&dpr=2&w=375,"Richard Joseph Neutra was an American architect. Living and building for the majority of his career in Southern California, he came to be considered among the most important modernist architects.",Age: Dec. at 78 (1892-1970),"Place of Birth: Vienna, Austria","Structures: Congregational Church in Hacienda Heights, Rajagopal Addition, Kronish House, Baldwin House by Neutra, Nuffer Cabin"
Santiago Calatrava,https://imgix.ranker.com/node_img/99/1974654/original/santiago-calatrava-writers-photo-1?auto=format&q=60&fit=crop&fm=pjpg&dpr=2&w=375,"Santiago Calatrava Valls is a Spanish neofuturistic architect, structural engineer, sculptor and painter. He has offices in New York City, Doha, and Zürich, where he now resides.",Age: 72,"Place of Birth: Benimàmet, Valencia","Structures: Centro Internacional de Ferias y Congresos de Tenerife, Museu de les Ciències Príncipe Felipe, Zurich Stadelhofen railway station, James Joyce Bridge, Gare do Oriente"
Louis Kahn,https://imgix.ranker.com/node_img/74/1477192/original/louis-kahn-writers-photo-1?auto=format&q=60&fit=crop&fm=pjpg&dpr=2&w=375,"Louis Isadore Kahn was an American architect, based in Philadelphia. After working in various capacities for several firms in Philadelphia, he founded his own atelier in 1935. While continuing his private practice, he served as a design critic and professor of architecture at Yale School of Architecture from 1947 to 1957. From 1957 until his death, he was a professor of architecture at the School of Design at the University of Pennsylvania. Kahn created a style that was monumental and monolithic; his heavy buildings do not hide their weight, their materials, or the way they are assembled. Louis Kahn's works are considered as monumental beyond modernism. Famous for his meticulously built works, his provocative proposals that remained unbuilt, and his teaching, Kahn was one of the most influential architects of the twentieth century. He was awarded the AIA Gold Medal and the RIBA Gold Medal. At the time of his death he was considered by some as ""America's foremost living architect.""",Age: Dec. at 73 (1901-1974),"Place of Birth: Estonia, Kuressaare","Structures: Kimbell Art Museum, Yale Center for British Art, Yale University Art Gallery, Phillips Exeter Academy Library, Trenton Jewish Community Center Bath House and Day Camp"
Oscar Niemeyer,https://imgix.ranker.com/node_img/87/1734198/original/oscar-niemeyer-writers-photo-1?auto=format&q=60&fit=crop&fm=pjpg&dpr=2&w=375,"Oscar Ribeiro de Almeida Niemeyer Soares Filho, known as Oscar Niemeyer, was a Brazilian architect who is considered to be one of the key figures in the development of modern architecture. Niemeyer was best known for his design of civic buildings for Brasília, a planned city that became Brazil's capital in 1960, as well as his collaboration with other architects on the United Nations Headquarters in New York City. His exploration of the aesthetic possibilities of reinforced concrete was highly influential in the late 20th and early 21st centuries. Both lauded and criticized for being a ""sculptor of monuments"", Niemeyer was hailed as a great artist and one of the greatest architects of his generation by his supporters. He said his architecture was strongly influenced by Le Corbusier, but in an interview, assured that this ""didn't prevent [his] architecture from going in a different direction"". Niemeyer was most famous for his use of abstract forms and curves and wrote in his memoirs:",Age: Dec. at 104 (1907-2012),"Place of Birth: Rio de Janeiro, Brazil","Structures: Latin America Memorial, Palácio do Jaburu, Penang State Mosque, National Congress building, Anhembi Sambadrome"
Daniel Libeskind,https://imgix.ranker.com/node_img/41/810380/original/daniel-libeskind-visual-artists-photo-1?auto=format&q=60&fit=crop&fm=pjpg&dpr=2&w=375,"Daniel Libeskind is a Polish-American architect, artist, professor and set designer of Polish Jewish descent. Libeskind founded Studio Daniel Libeskind in 1989 with his wife, Nina, and is its principal design architect. His buildings include the Jewish Museum in Berlin, Germany, the extension to the Denver Art Museum in the United States, the Grand Canal Theatre in Dublin, the Imperial War Museum North in Greater Manchester, England, the Michael Lee-Chin Crystal at the Royal Ontario Museum in Toronto, Canada, the Felix Nussbaum Haus in Osnabrück, Germany, the Danish Jewish Museum in Copenhagen, Denmark, and the Wohl Centre at the Bar-Ilan University in Ramat-Gan, Israel. His portfolio also includes several residential projects. Libeskind's work has been exhibited in major museums and galleries around the world, including the Museum of Modern Art, the Bauhaus Archives, the Art Institute of Chicago, and the Centre Pompidou. On February 27, 2003, Libeskind won the competition to be the master plan architect for the reconstruction of the World Trade Center site in Lower Manhattan.",Age: 77,"Place of Birth: Łódź, Poland","Structures: Bord Gáis Energy Theatre, Imperial War Museum North, The Crystals, One World Trade Center, L Tower"
Le Corbusier,https://imgix.ranker.com/node_img/73/1442121/original/le-corbusier-writers-photo-1?auto=format&q=60&fit=crop&fm=pjpg&dpr=2&w=375,"Charles-Édouard Jeanneret-Gris, who was better known as Le Corbusier, was a Swiss-French architect, designer, painter, urban planner, writer, and one of the pioneers of what is now called modern architecture. He was born in Switzerland and became a French citizen in 1930. His career spanned five decades, with his buildings constructed throughout Europe, India, and America. Dedicated to providing better living conditions for the residents of crowded cities, Le Corbusier was influential in urban planning, and was a founding member of the Congrès international d'architecture moderne. Corbusier prepared the master plan for the planned city of Chandigarh in India, and contributed specific designs for several buildings there.",Age: Dec. at 77 (1887-1965),"Place of Birth: La Chaux-de-Fonds, Switzerland","Structures: National Museum of Western Art, Tsentrosoyuz building, Palace of Justice, Chandigarth, India"
,,,,,
Richard Meier,https://imgix.ranker.com/node_img/96/1905618/original/richard-meier-architects-photo-1?auto=format&q=60&fit=crop&fm=pjpg&dpr=2&w=375,"Richard Meier is an American abstract artist and architect, whose geometric designs make prominent use of the color white. A winner of the Pritzker Architecture Prize in 1984, some of his more iconic buildings include the Barcelona Museum of Contemporary Art and the Getty Center in Los Angeles.",Age: 89,"Place of Birth: Downtown Newark, Newark, New Jersey","Structures: Sandra Day O'Connor United States Courthouse, Barcelona Museum of Contemporary Art, Twin Parks Northeast Housing Complex, Frederick J. Smith House, Museum für angewandte Kunst Frankfurt"
Alvar Aalto,https://imgix.ranker.com/node_img/23/442913/original/alvar-aalto-writers-photo-1?auto=format&q=60&fit=crop&fm=pjpg&dpr=2&w=375,"Hugo Alvar Henrik Aalto was a Finnish architect and designer, as well as a sculptor and painter. His work includes architecture, furniture, textiles and glassware. Aalto's early career runs in parallel with the rapid economic growth and industrialization of Finland during the first half of the twentieth century and many of his clients were industrialists; among these were the Ahlström-Gullichsen family. The span of his career, from the 1920s to the 1970s, is reflected in the styles of his work, ranging from Nordic Classicism of the early work, to a rational International Style Modernism during the 1930s to a more organic modernist style from the 1940s onwards. His furniture designs were considered Scandinavian Modern. What is typical for his entire career, however, is a concern for design as a Gesamtkunstwerk, a total work of art; whereby he – together with his first wife Aino Aalto – would design not just the building, but give special treatments to the interior surfaces and design furniture, lamps, and furnishings and glassware. The Alvar Aalto Museum, designed by Aalto himself, is located in what is regarded as his home city Jyväskylä.",Age: Dec. at 78 (1898-1976),"Place of Birth: Kuortane, Finland","Structures: Säynätsalo Town Hall, KUNSTEN Museum of Modern Art Aalborg, PK2 Summa Mill Building, Villa Mairea, Mount Angel Abbey"
,,,,,
Moshe Safdie,https://imgix.ranker.com/node_img/81/1617862/original/moshe-safdie-writers-photo-1?auto=format&q=60&fit=crop&fm=pjpg&dpr=2&w=375,"Moshe Safdie, CC, FAIA is an Israeli/Canadian/American architect, urban designer, educator, theorist, and author. He is most identified with Habitat 67, which paved the way for his international career.",Age: 85,"Place of Birth: Haifa, Israel","Structures: Pantages Tower, Vancouver Central Library, National Gallery of Canada, Habitat 67, The Class of 1959 Chapel"
Michael Graves,https://imgix.ranker.com/node_img/79/1574049/original/michael-graves-architects-photo-1?auto=format&q=60&fit=crop&fm=pjpg&dpr=2&w=375,"Michael Graves was an American architect. Identified as one of The New York Five, as well as Memphis Group, Graves was known first for his contemporary building designs and some prominent public commissions that became iconic examples of Postmodern architecture, such as the Portland Building and the Denver Public Library. His recognition grew through designing domestic products sold by premium Italian housewares maker Alessi, and later low-cost new designs at stores such as Target and J. C. Penney in the United States. He was a representative of New Urbanism and New Classical Architecture and formerly designed postmodern buildings, and was recognized as a major influence in all three movements.",Age: 89,"Place of Birth: Indianapolis, Indiana","Structures: Disney's Hotel New York, Snyderman House, Newark Museum, Portland Building, Walt Disney World Dolphin"
,,,,,
Norman Foster,https://imgix.ranker.com/node_img/102/2039643/original/sir-norman-foster-writers-photo-1?auto=format&q=60&fit=crop&fm=pjpg&dpr=2&w=375,"Norman Robert Foster, Baron Foster of Thames Bank, OM, HonFREng is an English architect whose company, Foster + Partners, maintains an international design practice famous for high-tech architecture. He is one of Britain's most prolific architects of his generation. In 1999 he was awarded the Pritzker Architecture Prize, often referred to as the Nobel Prize of architecture. In 2009 Foster was awarded the Prince of Asturias Award in the Arts category. In 1994 he received the AIA Gold Medal.",Age: 88,Place of Birth: England,"Structures: National Portrait Gallery, Terminal 3, Beijing Capital International Airport, 30 St Mary Axe, Metro Bilbao"
Renzo Piano,https://imgix.ranker.com/node_img/95/1893546/original/renzo-piano-writers-photo-1?auto=format&q=60&fit=crop&fm=pjpg&dpr=2&w=375,"Renzo Piano, Cavaliere di Gran Croce OMRI is an Italian Pritzker Prize-winning architect. Architecture critic Nicolai Ouroussoff said of Piano's works that the ""...serenity of his best buildings can almost make you believe that we live in a civilized world."" In 2006, Piano was selected by TIME as one of the 100 most influential people in the world. He was selected as the 10th most influential person in the ""Arts and Entertainment"" category of the 2006 Time 100. In August 2013 he was appointed Senator for Life in the Italian Senate by President Giorgio Napolitano.",Age: 86,"Place of Birth: Genoa, Italy","Structures: California Academy of Sciences, The New York Times Building, Art Institute of Chicago Building, Morgan Library, Vulcano Buono"
Philip Johnson,https://imgix.ranker.com/node_img/90/1794126/original/philip-johnson-visual-artists-photo-1?auto=format&q=60&fit=crop&fm=pjpg&dpr=2&w=375,"Philip Cortelyou Johnson was an influential American architect. He is especially known for his postmodern work since the 1980s. In 1930, he founded the Department of Architecture and Design at the Museum of Modern Art in New York City. In 1978 he was awarded an American Institute of Architects Gold Medal and in 1979 the first Pritzker Architecture Prize. He was a student at the Harvard Graduate School of Design. Johnson was gay, and has been called ""the best-known openly gay architect in America."" In 1961, he was elected into the National Academy of Design as an Associate member and became a full Academician in 1963. He came out publicly in 1993. Johnson died in his sleep while at his Glass House retreat in 2005. He was survived by his partner of 45 years, David Whitney, who died later that year at age 66.",Age: Dec. at 98 (1906-2005),"Place of Birth: USA, Cleveland, Ohio","Structures: 190 South LaSalle Street, Elmer Holmes Bobst Library, Two International Place, One International Place, Glass House"
Ludwig Mies van der Rohe,https://imgix.ranker.com/user_node_img/75/1484712/original/ludwig-mies-van-der-rohe-writers-photo-u1?auto=format&q=60&fit=crop&fm=pjpg&dpr=2&w=375,"Ludwig Mies van der Rohe was a German-American architect. He is commonly referred to and was addressed as Mies, his surname. Along with Le Corbusier, Walter Gropius and Frank Lloyd Wright, he is widely regarded as one of the pioneering masters of modern architecture. Mies, like many of his post-World War I contemporaries, sought to establish a new architectural style that could represent modern times just as Classical and Gothic did for their own eras. He created an influential twentieth-century architectural style, stated with extreme clarity and simplicity. His mature buildings made use of modern materials such as industrial steel and plate glass to define interior spaces. He strove toward an architecture with a minimal framework of structural order balanced against the implied freedom of free-flowing open space. He called his buildings ""skin and bones"" architecture. He sought a rational approach that would guide the creative process of architectural design, but he was always concerned with expressing the spirit of the modern era. He is often associated with his quotation of the aphorisms, ""less is more"" and ""God is in the details"".",Age: Dec. at 83 (1886-1969),"Place of Birth: Aachen, Germany","Structures: Lafayette Pavilion Apartments, 1300 Lafayette East Cooperative, S. R. Crown Hall, Barcelona Pavilion, Highfield House Condominium"
Erich Mendelsohn,https://imgix.ranker.com/node_img/48/948341/original/erich-mendelsohn-writers-photo-1?auto=format&q=60&fit=crop&fm=pjpg&dpr=2&w=375,"Erich Mendelsohn was a Jewish German architect, known for his expressionist architecture in the 1920s, as well as for developing a dynamic functionalism in his projects for department stores and cinemas. Mendelsohn is a pioneer of the Art Deco and Streamline Moderne architecture, notably with his 1921 Mossehaus design.",Age: Dec. at 66 (1887-1953),"Place of Birth: Olsztyn, Poland","Structures: Dr C Weitzman House, Jerusalem, Park Synagogue, The De La Warr Pavilion, Mossehaus"
Rem Koolhaas,https://imgix.ranker.com/node_img/95/1892035/original/rem-koolhaas-writers-photo-1?auto=format&q=60&fit=crop&fm=pjpg&dpr=2&w=375,"Remment Lucas ""Rem"" Koolhaas is a Dutch architect, architectural theorist, urbanist and Professor in Practice of Architecture and Urban Design at the Graduate School of Design at Harvard University. Koolhaas studied at the Architectural Association School of Architecture in London and at Cornell University in Ithaca, New York. Koolhaas is the founding partner of OMA, and of its research-oriented counterpart AMO based in Rotterdam, the Netherlands. In 2005, he co-founded Volume Magazine together with Mark Wigley and Ole Bouman In 2000, Rem Koolhaas won the Pritzker Prize. In 2008, Time put him in their top 100 of The World's Most Influential People.",Age: 79,"Place of Birth: Netherlands, Rotterdam","Structures: Dee and Charles Wyly Theatre, Casa da Música, Maison a Bordeaux, 111 First Street, Embassy of the Netherlands"
Marcel Breuer,https://imgix.ranker.com/node_img/76/1515005/original/marcel-breuer-writers-photo-1?auto=format&q=60&fit=crop&fm=pjpg&dpr=2&w=375,"Marcel Lajos Breuer, was a Hungarian-born modernist, architect and furniture designer. One of the masters of Modernism, Breuer extended the sculptural vocabulary he had developed in the carpentry shop at the Bauhaus into a personal architecture that made him one of the world’s most popular architects at the peak of 20th-Century design.",Age: Dec. at 79 (1902-1981),"Place of Birth: Pécs, Hungary","Structures: Saint John's Abbey, Waldenmark, Robert C. Weaver Federal Building, Whitney Museum of American Art, Flaine Resort"
Robert Venturi,https://imgix.ranker.com/node_img/97/1923217/original/robert-venturi-writers-photo-1?auto=format&q=60&fit=crop&fm=pjpg&dpr=2&w=375,"Robert Charles Venturi, Jr. is an American architect, founding principal of the firm Venturi, Scott Brown and Associates, and one of the major architectural figures in the twentieth century. Together with his wife and partner, Denise Scott Brown, he helped to shape the way that architects, planners and students experience and think about architecture and the American built environment. Their buildings, planning, theoretical writings and teaching have also contributed to the expansion of discourse about architecture. Venturi was awarded the Pritzker Prize in Architecture in 1991; the prize was awarded to him alone, despite a request to include his equal partner Denise Scott Brown. A group of women architects attempted to get her name added retroactively to the prize, but the Pritzker Prize jury declined to do so. Venturi is also known for coining the maxim ""Less is a bore"", a postmodern antidote to Mies van der Rohe's famous modernist dictum ""Less is more"". Venturi lives in Philadelphia with Denise Scott Brown.",Age: 98,"Place of Birth: Philadelphia, Pennsylvania","Structures: Best Products Warehouse, Gordon Wu Hall, Sainsbury Wing, Allen Memorial Art Museum, Vanna Venturi House"
Robert A. M. Stern,https://imgix.ranker.com/node_img/96/1917696/original/robert-a-m-stern-architects-photo-1?auto=format&q=60&fit=crop&fm=pjpg&dpr=2&w=375,"Robert Arthur Morton Stern, usually credited as Robert A. M. Stern, is an American architect and writer. He is currently the Dean of the Yale School of Architecture. Stern is a representative of New Urbanism and New Classical Architecture, with a particular emphasis on urban context and the continuity of traditions. He may have been the first architect to use the term ""postmodernism,"" but more recently he has used the phrase ""Modern traditionalist"" to describe his work. In 2011, Stern was honored with the renowned Driehaus Architecture Prize for his achievements in contemporary classical architecture. Some of his firm's major works include New York City's new classical 15 Central Park West, and the late modern Comcast Center skyscraper in Philadelphia.",Age: 84,"Place of Birth: New York City, New York","Structures: Hobby Center for the Performing Arts, 99 Church Street, Comcast Center, Nashville Public Library Central Library, Mandarin Oriental"
Charles Rennie Mackintosh,https://imgix.ranker.com/node_img/36/704427/original/charles-rennie-mackintosh-writers-photo-1?auto=format&q=60&fit=crop&fm=pjpg&dpr=2&w=375,"Charles Rennie Mackintosh was a Scottish architect, designer, water colourist and artist. He was a designer in the post impressionist movement and also the main representative of Art Nouveau in the United Kingdom. He had considerable influence on European design. He was born in Glasgow and he died in London.",Age: Dec. at 60 (1868-1928),"Place of Birth: Glasgow, United Kingdom","Structures: Hill House, Queen's Cross Church, Glasgow, Cranston Tearoom, The Lighthouse"
Stanford White,https://imgix.ranker.com/node_img/105/2084229/original/stanford-white-writers-photo-1?auto=format&q=60&fit=crop&fm=pjpg&dpr=2&w=375,"Stanford White was an American architect and partner in the architectural firm of McKim, Mead & White, the frontrunner among Beaux-Arts firms. He designed a long series of houses for the rich, and numerous public, institutional, and religious buildings. His design principles embodied the ""American Renaissance"". In 1906, White was murdered by millionaire Harry Kendall Thaw over White's affair with Thaw's wife, actress Evelyn Nesbit, leading to a court case which was dubbed ""The Trial of the Century"" by contemporary reporters.",Age: Dec. at 52 (1853-1906),"Place of Birth: New York City, New York","Structures: Washington Club, Tiffany and Company Building, Pennsylvania Station, The Rotunda, Hall of Fame Complex"
Tadao Ando,https://imgix.ranker.com/node_img/108/2141616/original/tadao-ando-architects-photo-1?auto=format&q=60&fit=crop&fm=pjpg&dpr=2&w=375,"Tadao Ando is a Japanese self-taught architect whose approach to architecture and landscape was categorized by architectural historian Francesco Dal Co as ""critical regionalism"".",Age: 82,"Place of Birth: Minato-ku, Osaka, Japan","Structures: Hyōgo Prefectural Museum of Art, Nagaragawa Convention Center, Pulitzer Foundation for the Arts, Church of the Light, Piccadilly Gardens"
James Wyatt,https://imgix.ranker.com/node_img/64/1265167/original/james-wyatt-architects-photo-1?auto=format&q=60&fit=crop&fm=pjpg&dpr=2&w=375,"James Wyatt RA, was an English architect, a rival of Robert Adam in the neoclassical style and neo-Gothic style.",Age: Dec. at 67 (1746-1813),"Place of Birth: Weeford, United Kingdom","Structures: Fonthill Abbey, Castle Coole, Pantheon, London, Sheffield Park"
