name,education,quote
Richard Morris Hunt,https://imgix.ranker.com/node_img/96/1905695/original/richard-morris-hunt-architects-photo-1?auto=format&q=60&fit=crop&fm=pjpg&dpr=2&w=375,"Richard Morris Hunt was an American architect of the nineteenth century and a preeminent figure in the history of American architecture. Hunt was, according to design critic Paul Goldberger writing in The New York Times, ""American architecture's first, and in many ways its greatest, statesman."" Aside from Hunt's sculpting of the face of New York City, including designs for the facade and Great Hall of the Metropolitan Museum of Art, the pedestal of the Statue of Liberty and many Fifth Avenue mansions lost to the wrecking ball, Hunt founded both the American Institute of Architects and the Municipal Art Society.",Age: Dec. at 66 (1828-1895),"Place of Birth: Brattleboro, Vermont","Structures: Association Residence Nursing Home, Lenox Library, Beechwood, Biltmore Estate, Ochre Court"
Daniel Burnham,https://imgix.ranker.com/node_img/41/809526/original/daniel-burnham-writers-photo-1?auto=format&q=60&fit=crop&fm=pjpg&dpr=2&w=375,"Daniel Hudson Burnham, FAIA was an American architect and urban designer. He was the Director of Works for the World's Columbian Exposition in Chicago. Burnham took a leading role in the creation of master plans for the development of a number of cities, including Chicago, Manila and downtown Washington, D.C. He also designed several famous buildings, including the Flatiron Building of triangular shape in New York City, Union Station in Washington D.C., the Continental Trust Company Building tower skyscraper in Baltimore, and a number of notable skyscrapers in Chicago.",Age: Dec. at 65 (1846-1912),"Place of Birth: Henderson, New York","Structures: John Wanamaker Store, Flatiron Building, Ellicott Square Building, Santa Fe Building, Postal Square Building"
Eliel Saarinen,https://imgix.ranker.com/node_img/47/927239/original/eliel-saarinen-writers-photo-1?auto=format&q=60&fit=crop&fm=pjpg&dpr=2&w=375,Gottlieb Eliel Saarinen was a Finnish architect known for his work with art deco buildings in the early years of the 20th century. He was the father of Eero Saarinen.,Age: Dec. at 76 (1873-1950),"Place of Birth: Rantasalmi, Finland","Structures: Charles J. and Ingrid V. (Frendberg) Koebel House, Hvitträsk, Christ Church Lutheran, Crow Island School, Des Moines Art Center"
Charles Follen McKim,https://imgix.ranker.com/node_img/36/702272/original/charles-follen-mckim-architects-photo-1?auto=format&q=60&fit=crop&fm=pjpg&dpr=2&w=375,"Charles Follen McKim was an American Beaux-Arts architect of the late 19th century. Along with Stanford White, he provided the architectural expertise as a member of the partnership McKim, Mead & White.",Age: Dec. at 62 (1847-1909),Place of Birth: Pennsylvania,"Structures: University Club, St. Paul's Episcopal Church, Schomburg Center for Research in Black Culture, Bryan Lathrop House, Morgan Library"
Bertram Goodhue,https://imgix.ranker.com/node_img/29/572917/original/bertram-goodhue-writers-photo-1?auto=format&q=60&fit=crop&fm=pjpg&dpr=2&w=375,"Bertram Grosvenor Goodhue was an American architect celebrated for his work in neo-gothic design. He also designed notable typefaces, including Cheltenham and Merrymount for the Merrymount Press. Later in life, Goodhue freed his architectural style with works like El Fureidis in Montecito, one of only three estates designed by Goodhue.",Age: Dec. at 54 (1869-1924),"Place of Birth: Pomfret, Connecticut","Structures: Lihiwai, Honolulu Academy of Arts, Westpoint Chapel, Nebraska State Capitol, Rockefeller Chapel"
Frei Otto,https://imgix.ranker.com/node_img/52/1026975/original/frei-otto-architects-photo-1?auto=format&q=60&fit=crop&fm=pjpg&dpr=2&w=375,"Frei Paul Otto was a German architect and structural engineer noted for his use of lightweight structures, in particular tensile and membrane structures, including the roof of the Olympic Stadium in Munich for the 1972 Summer Olympics. Otto won the RIBA Royal Gold Medal in 2006 and was awarded the Pritzker Architecture Prize in 2015, shortly before his death.",Age: 98,Place of Birth: Germany,"Structures: Tuwaiq Palace, Olympic Stadium Munich"
Alexander Jackson Davis,https://imgix.ranker.com/node_img/22/426594/original/alexander-jackson-davis-architects-photo-1?auto=format&q=60&fit=crop&fm=pjpg&dpr=2&w=375,"Alexander Jackson Davis, or A. J. Davis, was one of the most successful and influential American architects of his generation, known particularly for his association with the Gothic Revival style. Davis was born in New York City to Cornelius Davis, a bookseller and editor of theological works, and Julia Jackson. He spent his early years in New Jersey and attended elementary school in upstate New York. In 1818, Davis went to Alexandria, Virginia, to learn the printing trade from a half-brother. Living mostly in New York City from 1823 onward, he studied at the American Academy of Fine Arts, the New-York Drawing Association, and from the Antique casts of the National Academy of Design. Dropping out of school, he became a respectable lithographer and from 1826 he worked as a draftsman for Josiah R. Brady, a New York architect who was an early exponent of the Gothic revival style: Brady's Gothic 1824 St. Luke's Episcopal Church is the oldest surviving structure in Rochester, New York.",Age: Dec. at 88 (1803-1892),"Place of Birth: New York City, New York","Structures: Reuel E. Smith House, Locust Grove, Blandwood Mansion and Gardens, Wadsworth Atheneum, Cannon Building"
Richard Upjohn,https://imgix.ranker.com/node_img/96/1906774/original/richard-upjohn-architects-photo-1?auto=format&q=60&fit=crop&fm=pjpg&dpr=2&w=375,"Richard Upjohn was a British-born American architect who emigrated to the United States and became most famous for his Gothic Revival churches. He was partially responsible for launching the movement to such popularity in the United States. Upjohn also did extensive work in and helped to popularize the Italianate style. He was a founder and the first president of the American Institute of Architects. His son, Richard Mitchell Upjohn, was also a well-known architect and served as a partner in his continued architectural firm in New York.",Age: Dec. at 76 (1802-1878),"Place of Birth: Shaftesbury, United Kingdom","Structures: Grace Church, Church of the Ascension, Episcopal, St. Paul's Episcopal Church, St. Paul's Episcopal Church"
Paul Rudolph,https://imgix.ranker.com/node_img/89/1769637/original/paul-rudolph-architects-photo-1?auto=format&q=60&fit=crop&fm=pjpg&dpr=2&w=375,"Paul Marvin Rudolph was an American architect and the Chair of Yale University's Department of Architecture for six years, known for his use of concrete and highly complex floor plans. His most famous work is the Yale Art and Architecture Building, a spatially complex Brutalist concrete structure.",Age: Dec. at 78 (1918-1997),"Place of Birth: Elkton, Kentucky","Structures: Orange County Government Center, Lippo Centre, Sanderling Beach Club, Yale Art and Architecture Building, Revere Quality Institute House"
,,,,,
Robert Smirke,https://imgix.ranker.com/node_img/97/1922676/original/robert-smirke-architects-photo-1?auto=format&q=60&fit=crop&fm=pjpg&dpr=2&w=375,"Smirke was the son of portrait painter Robert Smirke, and studied architecture as a pupil of classical architect John Soane in 1796, the same year he commenced his studies at the Royal Academy. He also studied and travelled in southern Europe for several years. Smirke designed public buildings in the classical style, including the main block and facade of the British Museum, the east wing of Somerset House and the adjacent King's (formerly Smirke) Building of King's College London, and the Royal College of Physicians building in Trafalgar Square (now known as Canada House). His domestic buildings were often in the Gothic style. Lowther Castle in Cumbria was his first job, in 1806, when he was just 25. Eastnor Castle was designed by him in the early 19th century. His buildings outside London included the Shire Halls of Gloucester, Shrewsbury and Hereford, plus alterations to Luton Hoo house. He also designed the second incarnation of the Covent Garden Theatre, now the Royal Opera House (destroyed by fire in 1857), and the General Post Office building in St Martins-le-Grand in the City of London (built between 1825 and 1829 (demolished c. 1910). Together with John Nash and Sir John Soane, he became official architect to the Office of Works in 1813. He advised the Parliamentary Commissioners on the building of new Churches from 1818 onwards, contributing four himself, including St George, Brandon Hill in Bristol. He was knighted in 1832, and received the RIBA Royal Gold Medal for Architecture in 1853. His brother Sydney Smirke was also an architect, best known for the circular reading room at the British Museum. He died in Cheltenham on April 18th 1867.",Age: Dec. at 86 (1780-1867),"Place of Birth: London, United Kingdom","Structures: Lancaster House, Lowther Castle, Banqueting House, Whitehall, Royal Mint"
Gian Lorenzo Bernini,https://imgix.ranker.com/node_img/54/1069218/original/gian-lorenzo-bernini-writers-photo-1?auto=format&q=60&fit=crop&fm=pjpg&dpr=2&w=375,"Gian Lorenzo Bernini was an Italian artist and a prominent architect who worked principally in Rome. He was the leading sculptor of his age, credited with creating the Baroque style of sculpture. In addition, he painted, wrote plays, and designed metalwork and stage sets. Bernini possessed the ability to depict dramatic narratives with characters showing intense psychological states, but also to organize large-scale sculptural works which convey a magnificent grandeur. His skill in manipulating marble ensured that he would be considered a worthy successor of Michelangelo, far outshining other sculptors of his generation, including his rival, Alessandro Algardi. His talent extended beyond the confines of sculpture to a consideration of the setting in which it would be situated; his ability to synthesize sculpture, painting and architecture into a coherent conceptual and visual whole has been termed by the art historian Irving Levin the ""unity of the visual arts"".",Age: Dec. at 81 (1598-1680),"Place of Birth: Naples, Italy","Structures: Trevi Fountain, Palazzo Montecitorio, St. Peter's Basilica, Palazzo Barberini, Sant'Andrea al Quirinale"
Hector Guimard,https://imgix.ranker.com/node_img/58/1142861/original/hector-guimard-visual-artists-photo-1?auto=format&q=60&fit=crop&fm=pjpg&dpr=2&w=375,"Hector Guimard was a French architect, who is now the best-known representative of the Art Nouveau style of the late nineteenth and early twentieth centuries. Guimard's critical reputation has risen since the 1960s, as many art historians have praised his architectural and decorative work, the best of it done during a relatively brief fifteen years of prolific creative activity.",Age: Dec. at 75 (1867-1942),"Place of Birth: Lyon, France","Structures: Rue François-Millet, 11, Agoudas Hakehilos Synagogue, Paris Metro Entrance, Castel Orgeval"
John Nash,https://imgix.ranker.com/node_img/66/1312115/original/john-nash-writers-photo-1?auto=format&q=60&fit=crop&fm=pjpg&dpr=2&w=375,"John Nash was a British architect responsible for much of the layout of Regency London under the patronage of the Prince Regent, and during his reign as George IV. Nash was also a pioneer in the use of the Picturesque in architecture. His best-known buildings are the Royal Pavilion, Brighton, and Buckingham Palace.",Age: Dec. at 83 (1752-1835),"Place of Birth: London Borough of Lambeth, United Kingdom","Structures: Attingham Park, Foley House, Haverford West, Blaise Hamlet, Garnstone Castle"
Edward Durell Stone,https://imgix.ranker.com/node_img/46/915218/original/edward-durell-stone-writers-photo-1?auto=format&q=60&fit=crop&fm=pjpg&dpr=2&w=375,Edward Durell Stone was a twentieth-century American architect and an early proponent of modern architecture in the United States.,Age: Dec. at 76 (1902-1978),"Place of Birth: Fayetteville, Arkansas","Structures: John F. Kennedy Center for the Performing Arts, North Carolina Museum of Art Stone Building, Jay Lewis House, North Carolina State Legislative Building, Stuart Company Plant and Office Building"
Wallace Harrison,https://imgix.ranker.com/node_img/118/2355547/original/wallace-harrison-writers-photo-1?auto=format&q=60&fit=crop&fm=pjpg&dpr=2&w=375,"Wallace Kirkman Harrison was an American architect. Harrison started his professional career with the firm of Corbett, Harrison & MacMurray, participating in the construction of Rockefeller Center. He is best known for executing large public projects in New York City and upstate, many of them a result of his long and fruitful personal relationship with Nelson Rockefeller, for whom he served as an adviser.",Age: Dec. at 86 (1895-1981),"Place of Birth: Worcester, Massachusetts","Structures: 1211 Avenue of the Americas, Trylon and Perisphere, Metropolitan Opera House, Cultural Education Center, Empire State Plaza"
George Frederick Bodley,https://imgix.ranker.com/node_img/53/1057578/original/george-frederick-bodley-architects-photo-1?auto=format&q=60&fit=crop&fm=pjpg&dpr=2&w=375,"George Frederick Bodley was an English Gothic Revival architect. He was a pupil of Sir George Gilbert Scott, and worked in partnership with Thomas Garner for much of his career.",Age: Dec. at 80 (1827-1907),"Place of Birth: Kingston upon Hull, United Kingdom","Structures: Queens College Chapel, St Bartholomew's Church, Wilmslow, Church of Saint John the Baptist, Liverpool"
Minoru Yamasaki,https://imgix.ranker.com/node_img/80/1594575/original/minoru-yamasaki-writers-photo-1?auto=format&q=60&fit=crop&fm=pjpg&dpr=2&w=375,"Minoru Yamasaki was an American architect, best known for designing the original World Trade Center in New York City and several other large-scale projects. Yamasaki was one of the most prominent architects of the 20th century. He and fellow architect Edward Durell Stone are generally considered to be the two master practitioners of ""New Formalism"".",Age: Dec. at 73 (1912-1986),"Place of Birth: Seattle, Washington","Structures: BOK Tower, Rainier Tower, 2 World Trade Center, Torre Picasso, 100 Washington Square"
Thomas Hastings,https://imgix.ranker.com/node_img/112/2236703/original/thomas-hastings-architects-photo-1?auto=format&q=60&fit=crop&fm=pjpg&dpr=2&w=375,"Thomas Hastings was an American architect, a partner in the firm of Carrère and Hastings.",Age: Dec. at 69 (1860-1929),"Place of Birth: New York City, New York","Structures: The Townsend House, Hotel Washington, Plaza Hotel, Tomb of the Unknowns, Cannon House Office Building"
Peter Behrens,https://imgix.ranker.com/node_img/90/1784721/original/peter-behrens-architects-photo-1?auto=format&q=60&fit=crop&fm=pjpg&dpr=2&w=375,"Peter Behrens was a German architect and designer. He was important for the modernist movement, and several of the movement's leading names in earlier stages of their careers.",Age: Dec. at 71 (1868-1940),"Place of Birth: Hamburg, Germany","Structures: Factory, New Ways, Own House, Art Building, Turbine Building"
Inigo Jones,https://imgix.ranker.com/node_img/62/1222540/original/inigo-jones-writers-photo-1?auto=format&q=60&fit=crop&fm=pjpg&dpr=2&w=375,"Inigo Jones is the first significant English architect of the early modern period, and the first to employ Vitruvian rules of proportion and symmetry in his buildings. He left his mark on London by single buildings, such as the Banqueting House, Whitehall, and in area design for Covent Garden square which became a model for future developments in the West End. He made major contributions to stage design by his work as theatrical designer for several dozen masques, most by royal command and many in collaboration with Ben Jonson.",Age: Dec. at 78 (1573-1652),"Place of Birth: Smithfield, London, London, United Kingdom","Structures: York Water Gate, Banqueting House, Whitehall, Coleshill House, Berks"
John Wellborn Root,https://imgix.ranker.com/node_img/66/1316279/original/john-wellborn-root-writers-photo-1?auto=format&q=60&fit=crop&fm=pjpg&dpr=2&w=375,John Wellborn Root was an American architect who was based in Chicago with Daniel Burnham. He was one of the founders of the Chicago School style. One of his buildings was designated a National Historic Landmark; others have been designated Chicago landmarks and listed on the National Register of Historic Places. In 1958 he received the AIA Gold Medal.,Age: Dec. at 41 (1850-1891),"Place of Birth: Lumpkin, Georgia","Structures: Reliance Building, William Chick Scarritt House, Society for Savings Building, Rookery Building, Montauk Building"
Giorgio Vasari,https://imgix.ranker.com/node_img/54/1072642/original/giorgio-vasari-writers-photo-1?auto=format&q=60&fit=crop&fm=pjpg&dpr=2&w=375,"Giorgio Vasari was an Italian painter, architect, writer and historian, most famous today for his Lives of the Most Excellent Painters, Sculptors, and Architects, considered the ideological foundation of art-historical writing.",Age: Dec. at 62 (1511-1574),"Place of Birth: Arezzo, Italy","Structures: Uffizi Gallery, Basilica of Santa Maria Novella, Palazzo della Carovana, Boboli Gardens, Vasari Corridor"
Asher Benjamin,https://imgix.ranker.com/node_img/26/500680/original/asher-benjamin-writers-photo-1?auto=format&q=60&fit=crop&fm=pjpg&dpr=2&w=375,Asher Benjamin was an American architect and author whose work transitioned between Federal style architecture and the later Greek Revival. His seven handbooks on design deeply influenced the look of cities and towns throughout New England until the Civil War. Builders also copied his plans in the Midwest and in the South.,Age: Dec. at 72 (1773-1845),"Place of Birth: Hartland, Connecticut","Structures: Locust Lawn Estate, Capt. Charles Leonard House, Blazo-Leavitt House, Headquarters House, Congregational Church of Chelsea"
Domenico Fontana,https://imgix.ranker.com/node_img/44/873620/original/domenico-fontana-architects-photo-1?auto=format&q=60&fit=crop&fm=pjpg&dpr=2&w=375,"Domenico Fontana was an Italian engineer of the late Renaissance, born in today's Ticino. He worked primarily in Italy.",Age: Dec. at 64 (1543-1607),"Place of Birth: Melide, Switzerland","Structures: San Luigi dei Francesi, Sistine Chapel, Lateran Palace, Quirinal Palace"
Henry Bacon,https://imgix.ranker.com/node_img/58/1149875/original/henry-bacon-visual-artists-photo-1?auto=format&q=60&fit=crop&fm=pjpg&dpr=2&w=375,"Henry Bacon was an American Beaux-Arts architect who is best remembered for the Lincoln Memorial in Washington, D.C., which was his final project.",Age: Dec. at 57 (1866-1924),"Place of Birth: Watseka, Illinois","Structures: Lincoln Memorial, Lincoln Memorial Reflecting Pool, George H. Bacon House"
Claude Nicolas Ledoux,https://imgix.ranker.com/node_img/38/743378/original/claude-nicolas-ledoux-architects-photo-1?auto=format&q=60&fit=crop&fm=pjpg&dpr=2&w=375,"Claude-Nicolas Ledoux was one of the earliest exponents of French Neoclassical architecture. He used his knowledge of architectural theory to design not only in domestic architecture but town planning; as a consequence of his visionary plan for the Ideal City of Chaux, he became known as a utopian. His greatest works were funded by the French monarchy and came to be perceived as symbols of the Ancien Régime rather than Utopia. The French Revolution hampered his career; much of his work was destroyed in the nineteenth century. In 1804, he published a collection of his designs under the title ""Architecture considered in relation to art, morals, and legislation."" In this book he took the opportunity of revising his earlier designs, making them more rigorously neoclassical and up to date. This revision has distorted an accurate assessment of his role in the evolution of Neoclassical architecture. His most ambitious work was the uncompleted Royal Saltworks at Arc-et-Senans, an idealistic and visionary town showing many examples of architecture parlante.",Age: Dec. at 70 (1736-1806),"Place of Birth: Marne, France","Structures: Toll Houses, Paris, Besançon Theatre, Royal Saltworks at Arc-et-Senans, Rotonde de la Villette"
Pier Luigi Nervi,https://imgix.ranker.com/node_img/91/1802730/original/pier-luigi-nervi-writers-photo-1?auto=format&q=60&fit=crop&fm=pjpg&dpr=2&w=375,"Pier Luigi Nervi was an Italian engineer. He studied at the University of Bologna and qualified in 1913. Dr. Nervi taught as a professor of engineering at Rome University from 1946-61. He is widely known as a structural engineer and an architect, and for his innovative use of reinforced concrete.",Age: Dec. at 87 (1891-1979),"Place of Birth: Sondrio, Italy","Structures: Cathedral of Saint Mary of the Assumption, Norfolk Scope Arena, Italia 61 Pavilion, PalaLottomatica, Palazzo delle Esposizioni"
James Gamble Rogers,https://imgix.ranker.com/node_img/64/1261181/original/james-gamble-rogers-architects-photo-1?auto=format&q=60&fit=crop&fm=pjpg&dpr=2&w=375,"James Gamble Rogers was an American architect best known for his academic commissions at Yale University, Columbia University, Northwestern University, and elsewhere.",Age: Dec. at 80 (1867-1947),Place of Birth: Kentucky,"Structures: Harkness Tower, Berkeley College, Hall of Graduate Studies, Fence Club, Delta Kappa Epsilon (Yale)"
Gottfried Semper,https://imgix.ranker.com/node_img/55/1090130/original/gottfried-semper-writers-photo-1?auto=format&q=60&fit=crop&fm=pjpg&dpr=2&w=375,"Gottfried Semper was a German architect, art critic, and professor of architecture, who designed and built the Semper Opera House in Dresden between 1838 and 1841. In 1849 he took part in the May Uprising in Dresden and was put on the government's wanted list. Semper fled first to Zürich and later to London. Later he returned to Germany after the 1862 amnesty granted to the revolutionaries. Semper wrote extensively about the origins of architecture, especially in his book The Four Elements of Architecture from 1851, and he was one of the major figures in the controversy surrounding the polychrome architectural style of ancient Greece. Semper designed works at all scales, from a baton for Richard Wagner to major urban interventions like the re-design of the Ringstraße in Vienna.",Age: Dec. at 75 (1803-1879),"Place of Birth: Altona, Hamburg, Germany","Structures: Bayreuth Festspielhaus, Gemäldegalerie Alte Meister, Semperoper, Dresden, Zwinger"
James Hoban,https://imgix.ranker.com/node_img/64/1261756/original/james-hoban-architects-photo-1?auto=format&q=60&fit=crop&fm=pjpg&dpr=2&w=375,"James Hoban was an Irish architect, best known for designing the White House in Washington, D.C.",Age: Dec. at 73 (1758-1831),"Place of Birth: Dessart, Callan, County Kildare","Structures: White House (2), William Seabrook House, White House, St Patrick's Church, Washington"
Francesco Borromini,https://imgix.ranker.com/node_img/51/1013727/original/francesco-borromini-writers-photo-1?auto=format&q=60&fit=crop&fm=pjpg&dpr=2&w=375,"Francesco Borromini, byname of Francesco Castelli, was an Italian architect born in today's Ticino who, with his contemporaries Gian Lorenzo Bernini and Pietro da Cortona, was a leading figure in the emergence of Roman Baroque architecture. A keen student of the architecture of Michelangelo and the ruins of Antiquity, Borromini developed an inventive and distinctive, if somewhat idiosyncratic, architecture employing manipulations of Classical architectural forms, geometrical rationales in his plans and symbolic meanings in his buildings. He seems to have had a sound understanding of structures, which perhaps Bernini and Cortona, who were principally trained in other areas of the visual arts, lacked. His soft lead drawings are particularly distinctive. He appears to have been a self-taught scholar, amassing a large library by the end of his life. His career was constrained by his personality. Unlike Bernini who easily adopted the mantle of the charming courtier in his pursuit of important commissions, Borromini was both melancholic and quick in temper which resulted in him withdrawing from certain jobs, and his death was by suicide.",Age: Dec. at 67 (1599-1667),"Place of Birth: Bissone, Switzerland","Structures: Santa Lucia in Selci, Sant'Andrea delle Fratte, San Carlo alle Quattro Fontane, Sant'Anna dei Palafrenieri, Palazzo Barberini"
Robert Mills,https://imgix.ranker.com/node_img/97/1921530/original/robert-mills-writers-photo-1?auto=format&q=60&fit=crop&fm=pjpg&dpr=2&w=375,"Robert Mills, known for designing the Washington Monument, is sometimes called the first native born American to be professionally trained as an architect, though Charles Bulfinch perhaps has a clearer claim to this honor. Mills studied in Charleston, South Carolina, as a student of Irish architect James Hoban—who later designed the White House, which became the official home of US presidents. Both Hoban and Mills were Freemasons.",Age: Dec. at 73 (1781-1855),"Place of Birth: Charleston, South Carolina","Structures: Colleton County Courthouse, New London Customhouse, Robert Mills House, Treasury Building, Circular Congregational Church and Parish House"
