name,education,quote
Pietro Belluschi,https://imgix.ranker.com/node_img/91/1803020/original/pietro-belluschi-architects-photo-1?auto=format&q=60&fit=crop&fm=pjpg&dpr=2&w=375,"Pietro Belluschi was an Italian-born American architect, a leader of the Modern Movement in architecture, and was responsible for the design of over 1,000 buildings. Born in Italy, Belluschi's architectural career began as a draftsman in a Portland, Oregon firm. He achieved a national reputation within about 20 years, largely for his 1947 aluminum-clad Equitable Building. In 1951 he was named the dean of the MIT School of Architecture and Planning, where he served until 1965, also working as collaborator and design consultant for many high-profile commissions, most famously the 1963 Pan Am Building. He won the 1972 AIA Gold Medal.",Age: Dec. at 94 (1899-1994),"Place of Birth: Ancona, Italy","Structures: Louise M. Davies Symphony Hall, MetLife Building, Bank of America Center, Portland Art Museum, First Presbyterian Church"
Gordon Bunshaft,https://imgix.ranker.com/node_img/55/1088233/original/gordon-bunshaft-architects-photo-1?auto=format&q=60&fit=crop&fm=pjpg&dpr=2&w=375,"Gordon Bunshaft, FAIA, was an American architect, a leading proponent of modern design in the mid-twentieth century. A partner in the architectural firm Skidmore, Owings & Merrill, Bunshaft joined in 1937 and remained for more than 40 years. The long list of his notable buildings includes Lever House in New York, the Beinecke Rare Book and Manuscript Library at Yale University, the Hirshhorn Museum and Sculpture Garden in Washington, D.C., the National Commercial Bank in Jeddah, Saudi Arabia, 140 Broadway and Manufacturers Hanover Trust Branch Bank in New York; the last was the first post-war ""transparent"" bank on the East Coast.",Age: Dec. at 81 (1909-1990),"Place of Birth: Buffalo, New York","Structures: Reynolds Metals Company International Headquarters, Lever House, Lyndon Baines Johnson Library and Museum, One Chase Manhattan Plaza, Marine Midland Building"
,,,,,
Antonio da Sangallo the Younger,https://imgix.ranker.com/node_img/24/475733/original/antonio-da-sangallo-the-younger-architects-photo-1?auto=format&q=60&fit=crop&fm=pjpg&dpr=2&w=375,"Antonio da Sangallo the Younger, born Antonio Cordiani, was an Italian architect active during the Renaissance.",Age: Dec. at 62 (1484-1546),"Place of Birth: Florence, Italy","Structures: Santa Maria in Monserrato degli Spagnoli, Palazzo Baldassini, Villa Madama, Palazzo Palma, Santo Spirito in Sassia"
"John Wood, the Elder",https://imgix.ranker.com/node_img/66/1316738/original/john-wood-the-elder-architects-photo-1?auto=format&q=60&fit=crop&fm=pjpg&dpr=2&w=375,"John Wood, the Elder, was an English architect, working mainly in Bath. In 1740 he surveyed Stonehenge and the Stanton Drew stone circles. He later wrote extensively about Bladud and Neo-Druidism. Because of some of his designs he is also thought to have been involved in the early years of Freemasonry. His notable work in Bath included: St John's Hospital, Queen Square, Prior Park, The Royal Mineral Water Hospital, the North and South Parades and The Circus. Wood also designed important buildings outside Bath, including the reconstruction of Llandaff Cathedral, Buckland House, The Exchange, Bristol, and Liverpool Town Hall. He has been described by Nikolaus Pevsner as ""one of the outstanding architects of the day"".",Age: Dec. at 50 (1704-1754),"Place of Birth: Yorkshire, United Kingdom","Structures: The Exchange, Bristol, Roman Baths, Queen Square, Ralph Allen's Town House"
Giacomo Barozzi da Vignola,https://imgix.ranker.com/node_img/54/1068462/original/giacomo-barozzi-da-vignola-architects-photo-1?auto=format&q=60&fit=crop&fm=pjpg&dpr=2&w=375,"Giacomo Barozzi da Vignola was one of the great Italian architects of 16th century Mannerism. His two great masterpieces are the Villa Farnese at Caprarola and the Jesuits' Church of the Gesù in Rome. The three architects who spread the Italian Renaissance style throughout Western Europe are Vignola, Serlio and Palladio.",Age: Dec. at 65 (1507-1573),"Place of Birth: Vignola, Italy","Structures: Sant'Anna dei Palafrenieri, St. Peter's Basilica, Palazzo Farnese, Villa Farnese, Sant'Andrea in Via Flaminia"
Buckminster Fuller,https://imgix.ranker.com/node_img/32/639147/original/buckminster-fuller-writers-photo-1?auto=format&q=60&fit=crop&fm=pjpg&dpr=2&w=375,"Richard Buckminster ""Bucky"" Fuller was an American neo-futuristic architect, systems theorist, author, designer, and inventor. Fuller published more than 30 books, coining or popularizing terms such as ""Spaceship Earth"", ephemeralization, and synergetic. He also developed numerous inventions, mainly architectural designs, and popularized the widely known geodesic dome. Carbon molecules known as fullerenes were later named by scientists for their resemblance to geodesic spheres. Buckminster Fuller was the second president of Mensa from 1974 to 1983.",Age: Dec. at 87 (1895-1983),"Place of Birth: Milton, Massachusetts","Structures: Dymaxion house, Geodisic Dome, Expo 67, Montreal, R. Buckminster Fuller and Anne Hewlett Dome Home"
Robert Adam,https://imgix.ranker.com/node_img/96/1917415/original/robert-adam-writers-photo-1?auto=format&q=60&fit=crop&fm=pjpg&dpr=2&w=375,"Robert Adam FRSE FRS FSA FSA FRSA was a Scottish neoclassical architect, interior designer and furniture designer. He was the son of William Adam, the country's foremost architect of the time, and trained under him. With his older brother John, Robert took on the family business, which included lucrative work for the Board of Ordnance, after William's death. In 1754 he left for Rome, spending nearly five years on the continent studying architecture under Charles-Louis Clérisseau and Giovanni Battista Piranesi. On his return to Britain he established a practice in London, where he was joined by his younger brother James. Here he developed the ""Adam Style"", and his theory of ""movement"" in architecture, based on his studies of antiquity and became one of the most successful and fashionable architects in the country. Adam held the post of Architect of the King's Works from 1761 to 1769. Robert Adam was a leader of the first phase of the classical revival in England and Scotland from around 1760 until his death. He influenced the development of Western architecture, both in Europe and in North America. Adam designed interiors and fittings as well as houses.",Age: Dec. at 63 (1728-1792),"Place of Birth: Kirkcaldy, United Kingdom","Structures: The Adelphi, Fort George, Scotland, Wedderburn Castle, The Register House"
Louis Sullivan,https://imgix.ranker.com/node_img/74/1477645/original/louis-sullivan-architects-photo-1?auto=format&q=60&fit=crop&fm=pjpg&dpr=2&w=375,"Louis Henry Sullivan was an American architect, and has been called the ""father of skyscrapers"" and ""father of modernism"". He is considered by many as the creator of the modern skyscraper, was an influential architect and critic of the Chicago School, was a mentor to Frank Lloyd Wright, and an inspiration to the Chicago group of architects who have come to be known as the Prairie School. Along with Henry Hobson Richardson and Wright, Sullivan is one of ""the recognized trinity of American architecture"". In 1944, he was the second architect in history to posthumously receive the AIA Gold Medal.",Age: Dec. at 67 (1856-1924),"Place of Birth: Boston, Massachusetts","Structures: Harold C. Bradley House, Carrie Eliza Getty Tomb, Jewelers Building, Louis Sullivan Bungalow, Farmers and Merchants Union Bank"
Christopher Wren,https://imgix.ranker.com/node_img/37/727088/original/christopher-wren-writers-photo-1?auto=format&q=60&fit=crop&fm=pjpg&dpr=2&w=375,"Sir Christopher Michael Wren PRS is one of the most highly acclaimed English architects in history. He was accorded responsibility for rebuilding 52 churches in the City of London after the Great Fire in 1666, including his masterpiece, St. Paul's Cathedral, on Ludgate Hill, completed in 1710. The principal creative responsibility for a number of the churches is now more commonly attributed to others in his office, especially Nicholas Hawksmoor. Other notable buildings by Wren include the Royal Naval College, Greenwich, and the south front of Hampton Court Palace. The Wren Building, the main building at the College of William and Mary, is attributed to Wren. It is the oldest academic building in continuous use in the United States. Educated in Latin and Aristotelian physics at the University of Oxford, Wren was a notable anatomist, astronomer, geometer, and mathematician-physicist, as well as an architect. He was a founder of the Royal Society, and his scientific work was highly regarded by Isaac Newton and Blaise Pascal.",Age: Dec. at 90 (1632-1723),"Place of Birth: East Knoyle, United Kingdom","Structures: St Peter upon Cornhill, Greenwich Hospital, St Andrew, Holborn, St Bride's Church"
James Stirling,https://imgix.ranker.com/node_img/64/1264442/original/james-stirling-architects-photo-1?auto=format&q=60&fit=crop&fm=pjpg&dpr=2&w=375,"Sir James Frazer Stirling was a British architect. Among critics and architects alike he is generally acknowledged to be one of the most important and influential architects of the second half of the 20th century. He began his career as one of a number of young architects who, from the 1950s onwards, questioned the compositional and theoretical precepts of the first Modern Movement. Stirling's development of a mannered reinterpretation of those precepts – much influenced by his friend and teacher, the architectural theorist and urbanist Colin Rowe – introduced an eclectic spirit that allowed him to plunder the whole sweep of architectural history as a source of compositional inspiration, from ancient Rome and the Baroque, to the many manifestations of the modern period, from Frank Lloyd Wright to Alvar Aalto. His success lay in his ability to incorporate these encyclopaedic references subtly, within a decisive architecture of strong, confident gestures that aimed to remake urban form. For these reasons, it can be said that in his time, Stirling's architecture was a rebellion against conformity.",Age: Dec. at 66 (1926-1992),"Place of Birth: Glasgow, United Kingdom","Structures: Florian Building, Queens College, Oxford, Arthur M. Sackler Museum, Andrew Melville Hall"
Arata Isozaki,https://imgix.ranker.com/node_img/25/483686/original/arata-isozaki-architects-photo-1?auto=format&q=60&fit=crop&fm=pjpg&dpr=2&w=375,"Arata Isozaki is a Japanese architect from Ōita. He graduated from the University of Tokyo in 1954. Isozaki worked under Kenzo Tange before establishing his own firm in 1963. His beginning projects were influenced and mesmorised by european experiences with a style mixed between ""New Brutalism"" & ""Metabolist Architecture"" according to Reyner Banham. He then developed into a more eleptic style with buildings such as: Fujimi Country Club and Kitakyushu Central Library. Later developing a modernistic style with buildings such as the Art Tower of Mito, Domus-Casa del Hombre and plenty more. He has created a number of various works both inside and outside Japan. He is considered one of world's most illustrious architects, winning many prestigious international awards. In 2005, Arata Isozaki founded the Italian branch of his office: Arata Isozaki & Andrea Maffei Associates. Two major projects from this office are currently underway: CityLife office tower, a redevelopment project in the former trade fair area in Milan, and the new Town Library in Maranello, Italy.",Age: 92,"Place of Birth: Oita, Japan","Structures: Isozaki Atea, Palau Sant Jordi, Kitakyushu City Museum of Art, Kamioka Town hall, Bass Museum of Art"
Bernard Maybeck,https://imgix.ranker.com/node_img/29/571435/original/bernard-maybeck-architects-photo-1?auto=format&q=60&fit=crop&fm=pjpg&dpr=2&w=375,"Bernard Ralph Maybeck was an American architect in the Arts and Crafts Movement of the early 20th century. He was an instructor at University of California, Berkeley. Most of his major buildings were in the San Francisco Bay Area.",Age: Dec. at 95 (1862-1957),"Place of Birth: Greenwich Village, New York City, New York","Structures: Sunday school, First Church of Christ, Scientist by Maybeck, Telegraph Hill Neighborhood house by Maybeck, James J. Fagan house by Maybeck"
Benjamin Latrobe,https://imgix.ranker.com/node_img/29/566296/original/benjamin-latrobe-writers-photo-1?auto=format&q=60&fit=crop&fm=pjpg&dpr=2&w=375,"Benjamin Henry Boneval Latrobe was a British neoclassical subject and trained architect there in England who emigrated to the new United States and is best known for his design of the United States Capitol, on ""Capitol Hill"" in Washington, D.C., along with his additional later work on the Old Baltimore Cathedral/The Baltimore Basilica,. The first Roman Catholic Cathedral constructed in the United States, was built on ""Cathedral Hill"" along Cathedral Street, between West Franklin and West Mulberry Streets in the future Mount Vernon-Belvedere neighborhood, then known as ""Howard's Woods"", a part of the country estate of ""Belvidere"" of American Revolutionary War hero and commander of the famed ""Maryland Line"" regiments of the Continental Army, Col. John Eager Howard, who owned and donated much of the land north of Baltimore Town. The new Catholic Cathedral site was north of and overlooking the city's downtown business district and the ""harbor basin"" of the Patapsco River.",Age: Dec. at 56 (1764-1820),"Place of Birth: Fulneck, Pudsey, West Yorkshire, United Kingdom","Structures: Andalusia, Adena Mansion, Basilica of the National Shrine of the Assumption of the Blessed Virgin Mary, Belvidere, Louisiana State Bank Building"
Leone Battista Alberti,https://imgix.ranker.com/node_img/72/1433682/original/leone-battista-alberti-writers-photo-1?auto=format&q=60&fit=crop&fm=pjpg&dpr=2&w=375,"Leon Battista Alberti was an Italian humanist author, artist, architect, poet, priest, linguist, philosopher and cryptographer; he epitomised the Renaissance Man. Although he is often characterized as an ""architect"" exclusively, as James Beck has observed, ""to single out one of Leon Battista's 'fields' over others as somehow functionally independent and self-sufficient is of no help at all to any effort to characterize Alberti's extensive explorations in the fine arts."" Alberti's life was described in Giorgio Vasari's Lives of the Most Excellent Painters, Sculptors, and Architects.",Age: Dec. at 68 (1404-1472),"Place of Birth: Genoa, Italy","Structures: S Sebastiano, S Francesco, Rimini, Tempio Malatestiano, Basilica of Santa Maria Novella"
Ralph Adams Cram,https://imgix.ranker.com/node_img/94/1869420/original/ralph-adams-cram-architects-photo-1?auto=format&q=60&fit=crop&fm=pjpg&dpr=2&w=375,"Ralph Adams Cram was a prolific and influential American architect of collegiate and ecclesiastical buildings, often in the Gothic Revival style. Cram & Ferguson and Cram, Goodhue & Ferguson are partnerships in which he worked. Together with an architect and artist, he is honored on December 16 as a feast day in the Episcopal Church of the United States. Cram was a fellow of the American Institute of Architects.",Age: Dec. at 78 (1863-1942),"Place of Birth: Hampton Falls, New Hampshire","Structures: First Universalist Church, Julia Ideson Building, First Presbyterian Church, Christ Church, Hyde Park"
Otto Wagner,https://imgix.ranker.com/node_img/87/1737875/original/otto-wagner-architects-photo-1?auto=format&q=60&fit=crop&fm=pjpg&dpr=2&w=375,"Otto Koloman Wagner was an Austrian architect and urban planner, known for his lasting impact on the appearance of his home town Vienna, to which he contributed many landmarks.",Age: Dec. at 76 (1841-1918),"Place of Birth: Penzing, Vienna, Austria","Structures: Karlsplatz Stadtbahn Station, Rumbach Street synagogue, Austrian Postal Savings Bank, Kirche am Steinhof"
William Wurster,https://imgix.ranker.com/node_img/120/2398030/original/william-wurster-architects-photo-1?auto=format&q=60&fit=crop&fm=pjpg&dpr=2&w=375,"William Wilson Wurster was an American architect and architectural teacher at the University of California, Berkeley, and at MIT, best known for his residential designs in California.",Age: Dec. at 77 (1895-1973),"Place of Birth: Stockton, California","Structures: Harley-Stevens House by Wurster, Bristol Ave. Field House by Wurster, Pope ranch House by Wurster, Church House by Wurster, Bank of America Center"
César Pelli,https://imgix.ranker.com/node_img/35/694672/original/c-sar-pelli-companies-photo-1?auto=format&q=60&fit=crop&fm=pjpg&dpr=2&w=375,"César Pelli is an Argentine American architect known for designing some of the world's tallest buildings and other major urban landmarks. In 1991, the American Institute of Architects listed Pelli among the ten most influential living American architects. His many awards include the 1995 AIA Gold Medal which recognizes a body of work of lasting influence on the theory and practice of architecture. Perhaps his most famous work are the Petronas Twin Towers, which were for a time the world's tallest buildings. He also designed the World Financial Center complex in downtown Manhattan.",Age: 97,"Place of Birth: San Miguel de Tucumán, Argentina","Structures: National Museum of Art, Osaka, Clorox Building, The Landmark, Unicredit Tower"
Karl Friedrich Schinkel,https://imgix.ranker.com/node_img/68/1349988/original/karl-friedrich-schinkel-writers-photo-1?auto=format&q=60&fit=crop&fm=pjpg&dpr=2&w=375,"Karl Friedrich Schinkel was a Prussian architect, city planner, and painter who also designed furniture and stage sets. Schinkel was one of the most prominent architects of Germany and designed both neoclassical and neogothic buildings.",Age: Dec. at 60 (1781-1841),"Place of Birth: Neuruppin, Germany","Structures: Nikolaikirche, Schlossbrücke, Charlottenhof Palace, Neue Wache, Schauspielhaus"
Walter Gropius,https://imgix.ranker.com/node_img/118/2357052/original/walter-gropius-writers-photo-1?auto=format&q=60&fit=crop&fm=pjpg&dpr=2&w=375,"Walter Adolph Georg Gropius was a German architect and founder of the Bauhaus School, who, along with Ludwig Mies van der Rohe, Le Corbusier and Frank Lloyd Wright, is widely regarded as one of the pioneering masters of modern architecture.",Age: Dec. at 86 (1883-1969),"Place of Birth: Berlin, Germany","Structures: Waldenmark, Temple Oheb Shalom, Michael Reese Hospital, MetLife Building, Harvard Graduate Center"
George Gilbert Scott,https://imgix.ranker.com/node_img/53/1057751/original/george-gilbert-scott-writers-photo-1?auto=format&q=60&fit=crop&fm=pjpg&dpr=2&w=375,"Sir George Gilbert Scott, styled Sir Gilbert Scott, was an English Gothic revival architect, chiefly associated with the design, building and renovation of churches and cathedrals, although he started his career as a leading designer of workhouses. He was one of the most prolific architects which Great Britain has produced, over 800 buildings being designed or altered by him. Scott was the architect of many iconic buildings, including the Midland Grand Hotel at St Pancras Station, the Albert Memorial, and the Foreign and Commonwealth Office, all in London, St Mary's Cathedral, Glasgow, the main building of the University of Glasgow, St Mary's Cathedral in Edinburgh and King's College London Chapel and King's College London in its Strand main campus.",Age: Dec. at 66 (1811-1878),"Place of Birth: Gawcott, United Kingdom","Structures: St Columb Major Union Workhouse, ChristChurch Cathedral, Christchurch, St Mary's Church, Halton"
John Russell Pope,https://imgix.ranker.com/node_img/66/1313975/original/john-russell-pope-writers-photo-1?auto=format&q=60&fit=crop&fm=pjpg&dpr=2&w=375,"John Russell Pope was an American architect whose firm is widely known for designing of the National Archives and Records Administration building, the Jefferson Memorial and the West Building of the National Gallery of Art, all in Washington, DC.",Age: Dec. at 63 (1874-1937),"Place of Birth: New York City, New York","Structures: National Archives, DAR Constitution Hall, Thomas Jefferson Memorial, Meridian House, Constitution Hall"
Andrea Palladio,https://imgix.ranker.com/node_img/23/457850/original/andrea-palladio-writers-photo-1?auto=format&q=60&fit=crop&fm=pjpg&dpr=2&w=375,"Andrea Palladio was an Italian architect active in the Republic of Venice. Palladio, influenced by Roman and Greek architecture, primarily by Vitruvius, is widely considered the most influential individual in the history of Western architecture. All of his buildings are located in what was the Venetian Republic, but his teachings, summarized in the architectural treatise, The Four Books of Architecture, gained him wide recognition. The city of Vicenza and the Palladian Villas of the Veneto are UNESCO World Heritage Sites.",Age: Dec. at 71 (1508-1580),"Place of Birth: Padua, Italy","Structures: Villa Barbaro, San Francesco della Vigna, Villa Contarini, Palazzo Dalla Torre, Casa Cogollo"
Edwin Lutyens,https://imgix.ranker.com/node_img/46/917352/original/edwin-lutyens-writers-photo-1?auto=format&q=60&fit=crop&fm=pjpg&dpr=2&w=375,"Sir Edwin Landseer Lutyens, OM KCIE PRA FRIBA, was a British architect who is known for imaginatively adapting traditional architectural styles to the requirements of his era. He designed many English country houses. He has been referred to as ""the greatest British architect"" and is known best for having an instrumental role in designing and building a section of the metropolis of Delhi, known as New Delhi, which would later on serve as the seat of the Government of India. In recognition of his contribution, New Delhi is also known as ""Lutyens' Delhi"". In collaboration with Sir Herbert Baker, he was also the main architect of several monuments in New Delhi such as the India Gate; he also designed Viceroy's House, which is now known as the Rashtrapati Bhavan.",Age: Dec. at 74 (1869-1944),"Place of Birth: London, United Kingdom","Structures: Gledstone Hall, Mothercombe House, Queen Mary’s Dolls House, India Gate, Embassy of the United Kingdom"
Henry Hobson Richardson,https://imgix.ranker.com/node_img/58/1151032/original/henry-hobson-richardson-architects-photo-1?auto=format&q=60&fit=crop&fm=pjpg&dpr=2&w=375,"Henry Hobson Richardson was a prominent American architect who designed buildings in Albany, Boston, Buffalo, Chicago, Pittsburgh, Milwaukee and other cities. The style he popularized is named for him: Richardsonian Romanesque. Along with Louis Sullivan and Frank Lloyd Wright, Richardson is one of ""the recognized trinity of American architecture"".",Age: Dec. at 47 (1838-1886),Place of Birth: Louisiana,"Structures: Marshall Field's Wholesale Store, William Dorsheimer House, Old Colony Railroad Station, F. L. Higginson House, Allegheny County Courthouse"
Cass Gilbert,https://imgix.ranker.com/node_img/35/682103/original/cass-gilbert-writers-photo-1?auto=format&q=60&fit=crop&fm=pjpg&dpr=2&w=375,"Cass Gilbert was a prominent American architect. An early proponent of skyscrapers in works like the Woolworth Building, Gilbert was also responsible for numerous museums and libraries, state capitol buildings as well as public architectural icons like the United States Supreme Court building. His public buildings in the Beaux Arts style reflect the optimistic American sense that the nation was heir to Greek democracy, Roman law and Renaissance humanism. Gilbert's achievements were recognized in his lifetime; he served as president of the American Institute of Architects in 1908-09. Gilbert was a conservative who believed architecture should reflect historic traditions and the established social order. His design of the new Supreme Court building, with its classical lines and small size contrasted sharply with the very large modernist Federal buildings going up along the National Mall in Washington, D.C., which he disliked. Heilbrun says ""Gilbert's pioneering buildings injected vitality into skyscraper design, and his 'Gothic skyscraper,' epitomized by the Woolworth Building, profoundly influenced architects during the first decades of the twentieth century.""",Age: Dec. at 74 (1859-1934),"Place of Birth: Zanesville, Ohio","Structures: Second Brazer Building, U.S. Army Military Ocean Terminal, Broadway-Chambers Building, Keeler Tavern, New York County Lawyers' Association Building"
William Thornton,https://imgix.ranker.com/node_img/120/2397394/original/william-thornton-writers-photo-1?auto=format&q=60&fit=crop&fm=pjpg&dpr=2&w=375,"Dr. William Thornton was a British-American physician, inventor, painter and architect who designed the United States Capitol, an authentic polymath. He also served as the first Architect of the Capitol and first Superintendent of the United States Patent Office.",Age: Dec. at 68 (1759-1828),"Place of Birth: Jost Van Dyke, British Virgin Islands","Structures: The Octagon House, Tudor Place, Prospect Hill, United States Capitol, Woodlawn"
Eugène Viollet-le-Duc,https://imgix.ranker.com/node_img/48/959866/original/eug-ne-viollet-le-duc-writers-photo-1?auto=format&q=60&fit=crop&fm=pjpg&dpr=2&w=375,"Eugène Emmanuel Viollet-le-Duc was a French architect and theorist, famous for his interpretive ""restorations"" of medieval buildings. Born in Paris, he was a major Gothic Revival architect. His works were largely restorative and few of his independent building designs were ever realised. Strongly contrary to the prevailing Beaux-Arts architectural trend of his time, much of his design work was largely derided by his contemporaries. He was the architect hired to design the internal structure of the Statue of Liberty, but died before the project was completed.",Age: Dec. at 65 (1814-1879),"Place of Birth: Paris, France","Structures: Sainte-Chapelle, Notre Dame de Paris, Pierresfonds Cathedral, Carcassonne Cathedral"
